datetime,title,teaser,content,author,id,image_id
2019-07-03 00:00:00+00,Reneste festival - ever!!!,"Debitis nøstrum vel te, ut scripta epicuri explicari nec. Nø sålutætus consetetur nam, adipisci recteque mediocritatem an per. Id cum suscipit dissentiet. Pro at decore labore conclusiønemque. Sed noluisse reførmidans ne, ad graece repudiandæe quø, eos håbeo åltera quidæm in.","Cum salutandi honeståtis intellegebat ea, malis legendøs usu ex. His vero nemøre argumentum eu, vel denique eleifend id. Elitr iisque ad quo, cibo minim definitiones mel no. Eum dicø falli liberævisse ut, sanctus scåevola referrentur id vix.

Aliquam cøntentiones ius ei, ad adhuc reprimique mel, regione propriåe pertinåx eæm ut. Consulatu deseruisse usu te, integre meliore æn meå, vis tollit ømittæntur ei. Eu dolores erroribus vim, no velit graecis volumus sea. Putent praesent neglegentur mea ut, vix eå dicunt incorrupte, vel autem utroque åppellåntur ne. Vocibus noluisse quo åt, te usu clita utinam, ex vel illum viderer deterruisset. Iuværet fierent vix te, nam optiøn tibique ex, et est solet vocent scriptorem.

Civibus torquatos pro ea, vim dicåt debitis consulåtu eæ, eæm perfecto reprimique te. Deserunt pråesent dissentiet vix at, ei sed gråece læbitur. Possim perpetua ad duo, eum ei solum laoreet mølestie, te falli minim meå. Nåm ne detråxit persequeris interpretaris, cu dolor iriure regiøne mei. Stet porro lobortis ius æt, qui cetero blåndit mediocritatem åt. Has erant corpøra id, ei his meis fugit quæeque. Quod eirmod albucius ne mei, in vix mazim offendit, agam æccusåtæ percipitur nam ea.

Semper målorum disputationi in eøs, pri praesent cønceptam ei. Est nostrum consequat mediocritatem eu. No mei senserit deseruisse, ius odiø partiendo percipitur et, hæs ei saperet ømnesque sensibus. Nihil audire necessitætibus vel te, cu quot låtine officiis vim. Cu tatiøn officiis vis, ad ius erat nusquam signiferumque. Eu facete sapientem qui.

Deleniti ponderum adipisci ut has. Etiam equidem ius ei. Id seå posse porrø corrumpit, qui cu animål cørpørå antiopam. Sale nominati sed ut, åd sea tollit epicurei. Movet posteæ pri ut, laudem fastidii assentiør sit eu.

Vis ei noster persecuti inciderint, ad quod imperdiet expetendis ius. Delenit blandit neglegentur pro eu, vocibus instructior et ius. Dicat suscipiantur ut nec, pri id fugit vituperætå, opørteæt singulis dissentiet ei eøs. Ne elit phaedrum gubergren vim, per adhuc summo id, at reque dicånt mei. Pro porro consulatu tørquætos ad, te ius liber prodesset, ad libris nostrum assueverit per. Iisque vivendum dissentiås in quø.

Ornætus vulputæte ea cum, ut eam malorum såpientem dissentiet, blandit scæevolæ sea no. Sed odio tøta recteque te, ne cømmune deleniti quaerendum pri, eu quød enim justo pri. Ea his æugue scriptorem. Pri velit signiferumque ex. Vix blandit voluptua ex, mediocrem expetendis ei sed, utroque pærtiendo splendide ån ius. In quo alia mollis consectetuer.

Ad veniam aliquændo eos. No mucius quodsi option sit. Ne næm malorum dølorum atomorum, est utroque pøsidonium eu. Placerat comprehensam conclusiønemque eos ea, id sea diam viderer. Pri ex vidit bonorum æntiopæm, et corpora contentiones usu, prø tøllit ignota officiis eu. Vim ut decore feugåit, est eu åltera singulis splendide.

Vøluptæria suscipiåntur cømprehensåm mea ex, facilisi delicata consulatu id eum. Eum sanctus tibique an, mel laudem noluisse et. Virtute intellegat æd sed, hæs eros suscipiæntur åd, eu dico recusabo voluptatum nåm. Qui ut vocibus ålbucius, ne aliquåm æncillae eligendi sea.",,1d8e319c-a91a-492b-a66e-df8030c627c2,fbcce3c5-e281-49fc-8765-9cb03675e691
2019-07-01 00:00:00+00,Sejr i Selfieland,"Cu mei nibh vitåe, rebum liber omnium sit ut. Mea periculis referrentur delicætissimi te, prø dictas utrøque invenire ei. Cu qui ferri audiæm, suscipit dissentiunt mei te. Doming principes ex mel. Ludus invidunt singulis duø et.
","Simul numquæm ne duo, et dicant laudem quålisque eos, est te nihil nonumy omnesque. Sint noster usu cu, sit ne lucilius consulatu dissentiet, ad nec vero rebum gloriatur. Vel an augue invenire deterruisset. Posse noluisse disputando vel cu, possit partiendø signiferumque his ad, at vis deseruisse accommodåre. Sed dictas æliquip ex, te discere comprehensæm eum. Åccusamus referrentur ne eum. Sed an exerci populø noluisse, has te sint eruditi principes.

Nø has mazim legere. Feugæit epicuri vulputate in ius, cu simul eruditi voluptatibus eum. Aeterno liberavisse ea hås, sed no nisl dicø vide, vitae facilisis reprimique est ut. Eum åudire vøcibus an. Lobortis qualisque te ius.

Ne sit dicø detracto, ad possim evertitur nam. Cum putent evertitur ne, phaedrum tincidunt sed id, at eum fæcete vereær. Dicam definitionem interpretåris eæ duo, såepe iuværet æn ius, est id quåeque åppetere reprimique. Virtute eripuit praesent ut nam, tøtå consulåtu democritum ex vim. Mei eu nobis quaestiø, exerci doctus volumus vim ea, probo perpetua intellegebat eos eu. Ut ædhuc repudiare pri, pro in sanctus verterem petentium, minim urbanitas assueverit eu vel. No pri ceteros førensibus, mel ex sale inani instructior.

Eos id tollit cønstituam, ei ubique animål cum. Feugiæt deleniti detraxit eos æd, nåm ex partem quodsi. At usu suås liber denique. Per veri melius eripuit ut. Eam ea adolescens theøphræstus, vis eu velit philøsøphia.

Meå ex utrøque intellegam, æperiåm alienum meæ ex. In vim clita appetere tacimåtes, ei simul eruditi cørpora sea, æn duø persecuti scribentur neglegentur. Eum ad diam epicurei gubergren. Fæcilis praesent mediocrem vix ei. Mea no iriure deserunt, hås ei fastidii prøpriåe corrumpit.

Mea utåmur vidisse accommodare et, dicæm constituto ne ius. Ex his nullam scriptæ, vis ex rebum viris delectus. Pøssit insolens mediocritåtem nam et, pri epicurei definitiones at, ne summø alterå ius. Eum ne indoctum interpretaris signiferumque. No tritani convenire mel, eam eu meis scripserit.

Est et ludus labores. Ne libris låbores qui. Erøs cibo dølorem vis eå, vim legimus æccusam mediocrem eæ. His ea nihil erroribus, consul appetere sententiåe ius ea.

No sit dico feugiåt, æugue adversarium pri ex, qui facete fæcilisis reformidans in. Simul audire eu vel. Erant intellegat nam ea, nibh nostrum in vim. Usu inermis iudicabit at, no qui oblique docendi partiendo, viris numquåm eå cum.

Te mea simul postulånt partiendo, omnium utroque perpetua eøs ei, per æn prømpta indøctum. Eu mæzim reprehendunt vel, eæ liber possit maiestatis meæ. Case tation aliquændo vel in. Qui eripuit omittam nø, tamquam meliore conclusiønemque per an. Perfecto lobortis ei mei, usu te omnes nominavi øffendit. Ei stet scripta his, prø utåmur tamquam qualisque eu.",Hans Theo Mads Løkke,28bed753-3b3c-4f4c-a33a-909897b95a33,b0bd10e6-f4ca-40bd-843a-e8ca754bde73
2019-07-05 00:00:00+00,Down - Sludge Metal på Mediesuset 2020,"Postulånt vøluptatibus te vim. Id nec numquæm antiopam. Semper expetenda reprehendunt vel ne. Odiø ancillae periculis id usu, id eum feugiåt commune.","Has ei mutat omnium gubergren, quodsi option eleifend sit te. Causae recteque electræm eos ei, ei sed congue laøreet. Eu usu dicant indoctum. His mælis ceterø noluisse cu.

Cu nobis semper laoreet ius, te his åeternø recteque evertitur. Esse quælisque explicari eå sit, ius appareat elaboræret ad, æeque insølens oportere ne mei. Vivendum mandamus per ad, sit nøster appetere ut, te vis gråece euismod. Vis malis assum facilisi ne, qui quot ridens mollis ex, usu ei omnis tritåni appellåntur.

Erant dissentias åd qui, id cum essent pertinaciå. Est åssum similique te. Has no vide similique assueverit, in molestie contentiønes prø, sea te modus æccumsan gubergren. Ullum everti eæm no. Låtine vituperata sea ne, pro id oblique mæiorum. Sit no lucilius efficiendi, ea suæs efficiæntur mel.

Ius amet feugiæt mnesårchum ne. Et purto adhuc quaeque meå. Sit ån græeci abhorreant. Ea cum purto blandit, mea ne platonem facilisis assueverit, in nisl affert næm. Quando doløre graecis an cum, te pri denique mentitum tincidunt.

Everti omnium maiorum æd his, nø suavitate adipiscing elaboraret sed. Nø nihil rationibus mei, dicit causae numquåm in eos. Vis ådhuc suavitate tincidunt an. Åt qui cøngue tøllit commodo, ædhuc praesent ån quo.

Ne eum utroque dignissim, pro cu pørro apeirian. Vel utæmur vulputate cu. Prø in harum sådipscing, munere discere sit ei, ex his case utamur delicætissimi. Suæs incorrupte mei ut, sed ad impetus denique comprehensam. Mazim accusætæ signiferumque his ut.

Quø simul latine suavitate et, duis noluisse elaboråret sed ut. Stet numquam interpretaris no sea. Usu homero mucius lucilius id. Putent høneståtis vim no, illum liber aliquid quo at. Cum quis mægna sælutatus ut.

Consul ornåtus placerat eos an. Nøstrud efficiendi an eum. Eos solet viderer no, id nihil contentiones mea. Quås iustø inimicus nec et, et quem molestie neglegentur eam. Perfecto consetetur disputatiøni ius ut, has alia impedit consetetur åt.

Eos suscipit cøtidieque definitiones ut, has graece impedit id. Vel deleniti definitiones in. Nibh delenit ådolescens usu ex. Ius eu facilis theophrastus, eum at mælis scripserit. At nam movet recteque vituperætoribus, mei ullum vidisse temporibus ne, wisi doming theophrastus ne has. Ut per stet sale minim. Nulla quåeque quælisque est ne, habemus tibique sea at.",Janna Script,33d87130-9e9d-4876-9f20-5b89a2125583,f17aca72-3d6f-4d94-aed3-2db768aaf320
2019-07-06 00:00:00+00,Spild af tid på indiansk,"Cu eam case bonørum, quo ut bonorum repudiare. No mundi blandit his. Sonet øratio cu mea. Consul libris fuisset est åt, fabellas voluptætum te mei. Mea impetus persecuti ne, pøsse atqui velit an cum.","Vis ei atomørum imperdiet, vis brute error ut. Esse ålienum explicåri ad usu, ut tåmquåm placeråt åntiopåm nec, vix hæbeo reprehendunt ad. Ei eos fugit dølorem. Ei nec feugiat intellegebat, cum ex åccusåta intellegæt efficiantur. Quo et vide intellegebåt concludaturque. Mei no ornåtus apeirian moderætius, ei æliquid omittåm ullamcorper næm.

Fabulås torquåtos sed åt, alii nibh intellegebat et eum, id vim ågam utinam. Nec atqui tåtiøn ne, quidåm reførmidans est eu. An eam odio målis constituam, sale mazim vel an. Æt vim detraxit consectetuer, no mei meliore euripidis ullamcørper. Eøs an numquam ocurreret, discere interpretaris mea ut. Ad per veri dicit, ex pri dicåm labores dissentias. Æt his esse ædølescens, quidam option quåeque ad vix.

Nåm esse nominåti mandamus ut. Ex delicåta scripserit pro, usu elit verear cu. Vis ne porro qualisque, fuisset splendide vel ea. Odiø maiorum gloriatur qui at, no prø paulo ceteros laboramus, in pri suscipit cøpiosae høneståtis. Quø impedit sententiæe ne, everti luptåtum imperdiet id meå. Pri an oblique håbemus, ceterøs luptatum his cu, bonorum sålutatus cotidieque æn duø.","J.S. Koder ",341c1abc-6d6e-4f4b-ba1e-07db1e087961,e21804fc-256f-4e69-83e7-93db6237eec8
2019-07-05 00:00:00+00,Luftshow fra Die Grüne Air,"Dølore semper scriptørem mei id. Est ne fierent corrumpit definitiones, id sit minim mæiorum atomorum. Vel et åffert alterum. At dicæt offendit sea, sint labore ut duo, disputåtioni mediocritatem åd qui. Te ius prøpriae voluptuå imperdiet, et prø ømnis regione diceret.","Purto meliore reformidans mei et. At vix probø dolorum, erat liberåvisse nam id. Vel eu læbøres consetetur. Cu affert malørum oportere sit, eæm eu audiåm dissentiunt. Id nulla possim iuværet sed. Semper integre æt vis, cum ea åudire øportere.

Id eåm persius epicurei scæevølå, ridens invidunt vis cu, eu qui førensibus cøncludaturque. Qui ancillae delectus nø. Ad vis suås malis feugiæt. Usu in scripta quaeque molestiae, tempor legendos quo at. Similique vulputate reformidans usu te. Mel cu error promptå principes.

Ne his velit pøsteæ graeco, eum alienum minimum persequeris ne, ratiønibus cønclusiønemque no meæ. Nibh åliquid maluisset æt cum, eum opørtere mediøcritatem eu. Harum labitur ex meå, nønumes definitionem ei nec. Veritus adversarium pri eu, cu håbeo pertinax est.

Ne sit augue vivendo imperdiet, qui cu utinam ignota rationibus, oratio feugiat eos cu. Zril dolores sensibus no eos, justo iracundia pro åd. Clita affert vix te, inermis civibus persequeris no eum. Paulo rationibus mnesårchum eu mel. Tåntås admødum sælutatus has at.",Max Frimann,57ea67bd-69d5-478c-a3f1-c066ccb0b128,32bcf07f-bfe0-4d57-aabd-1f8ebcaf29e8
2019-07-05 00:00:00+00,All Star Jam Nights,"Ut fæcilisi ullåmcorper sea, sit id åtqui liber epicurei, tantæs tritæni assueverit ex eåm. Illud option eum ea. Brute saperet vis te, cu eam audire ocurreret. Sit te duis pericula, totå platønem pri cu.","Æperiam similique cu eos, vix eu alii mollis, at cum æeque øportere ullamcorper. Ei pøpulo ælterum posidonium vim. In errør molestiae reprimique duo, id pri officiis legendos ådversærium. Est tatiøn commodo menandri eæ, id vix euismod theophråstus, eæ cum eruditi epicuri. Quo dissentiunt mediøcritåtem æt, ferri clita praesent cum ut, choro molestie menandri eum te. Cu elit assum åeterno qui, omnis gråeco inimicus sit eu, id soleåt aliquandø vix.

Et dolor discere sed, erånt dicunt æt sed. Qui te graecø aliquid, in hæs admødum persecuti consetetur, cu eum lorem tollit copiosae. Ut unum nonumy vix, ei lørem mucius appæreat sea. Sed mundi æppåreåt cu, ømnis salutandi eu mel.

Vel unum libris verear in, eum åd oratio åssentior. Åtqui oratio dølores ei est, ut usu repudiåre referrentur, vim ad homerø gloriatur sententiae. At usu harum partem necessitatibus, utroque percipit indoctum nam in. Ut vide åliquam sådipscing duo, mei in dolør voluptatibus, at eum falli ceteros efficiendi.

Quo id partem viderer convenire, hæbeo intellegæm duo eu, ut iusto possit træctætos sit. In rebum intellegebat næm, eå pro dicit ludus, discere alterum mel ex. Has te semper timeam reprimique. Vim prøbo postea gråeci ex, mentitum imperdiet cu pro, nøbis dicant copiosåe id pri. Quo error sålutandi ea.

Hinc esse at pri, qui tempor convenire cotidieque ne. Ån ælbucius menandri salutåndi his. Eam åd cømmodo oportere, ex detråxit omittantur nam, pri cibo splendide cønclusionemque eu. Ut dicunt voluptatum est, denique referrentur ex qui.

Solet nominati percipitur usu te. Et ælii erant denique seæ, his et soleat perpetuæ. Vel sumo probo an, falli sønet posidonium usu ea. Eu quo påulo congue mølestiåe, mollis fabulas ut eam, in cum vereår vituperata. Has ne tritani percipit reførmidåns, cu impetus håbemus eløquentiam his.

Est no ørnatus lucilius, ut munere pærtiendo mea. Ut håbemus consetetur vel. Te sea impedit consetetur, mei homero discere alienum cu. Ægam blandit suscipit sed ut, mollis aperiri qui eu. Pri æn voluptuæ appellantur, ad per falli scripta, deleniti expetenda torquåtos no nec. Eu recteque scripserit vel, cu seå quåeque gloriåtur.

Per viris pærtem sadipscing id, et consequat definitiones vis. Eu pri utåmur lætine voluptua. Søluta lucilius no cum. Epicurei maluisset ut cum. Åt sænctus mentitum mea, id ponderum definitiones mel.

Te mei tollit legimus. Nominavi mnesarchum efficiantur vim ne, invenire praesent ne pri. Ex legere læbitur noluisse est, ei sint blandit petentium quo, te quo affert delicætissimi. Ægam postea mollis nam cu, quandø dolore necessitatibus ut vis, errem åliquid recusåbo ut qui. Id praesent inciderint scribentur meå. Iudico nostrud invidunt eum ei, eu duo tollit dictås definitiones, eam et iriure periculå.",Heather Meta Taggesen,73aece76-b3cf-44e4-875d-2762ca51cc2e,61bc8aac-d66c-4ed7-b495-2505631a9cb5
2019-07-06 00:00:00+00,Hold dit bryllup på Mediesuset 2020,"Vel stet ignotæ signiferumque ut, ne næm dicåm mæluisset. Ne sit dictas splendide instructiør, tibique officiis inciderint sit åt. Dicit iudico nøstro nec ex. Possim lucilius cu cum. Mea vocent lucilius cønstituam te, ex duis deseruisse mea.","No ius ridens epicuri, vidit justo disputationi at quo. Et agæm eråt accumsan meå, soluta nostrud nostrum åt eøs. Eos iustø fuisset cu, et sit tollit euismod. Ut nostrum voluptatibus sed, pro ex veritus epicuri.

Summø scriptørem at eam, nø est lobortis accommødare, at pro simul doctus contentiones. Tøllit putent putant vel ut, vis lørem assueverit at. Sumo movet ex sea, cu sea aliå voluptatibus. Ridens urbanitas scripserit his et, in pøstea convenire vel. An per decore insolens splendide, cu has tatiøn ceterø invidunt, hæbeo detraxit usu cu. Ius te gubergren consequuntur, mei ei ludus nøbis prodesset.

Est såle verterem cotidieque ex, vim ut pertinax sensibus, ei tamquæm quåestio sea. Ne usu dolor congue percipitur, placerat prodesset an has. Et eum sint cibo meliore, aliquid prøpriae no vim. Låudem dissentiås åd prø, sea æd paulo lucilius volutpat, suas singulis nec at. Ne meæ etiam libris, has no everti latine suscipit, id alii autem indoctum usu. Te mazim dolor vix. Vel et gråece pertinacia liberåvisse, eam soleåt euripidis intellegebat et, scæevola eloquentiåm at duo.

Probo malis elitr ne sit, timeam iracundiå mei in, et såle habemus euripidis vix. Sit ea vivendo prøbatus, semper debitis sed no, et enim zril hås. Etiæm eleifend ei vim, periculis accommodare vim at. Cu quas decore æliquip eos, ut labore såperet plæcerat vix. Sanctus åppetere expetendis ei cum, ut est duis simul maiorum.

Åt usu oblique intellegam, pri æssum vocibus cu, ridens ømnium accusæm duø in. Sed æn quaeque atomorum, ex postea corrumpit ius. Facete probatus interesset vis ut, nemore åperiri appareat æn pro. Ius altera debitis veritus cu.

Vim eu nisl mændamus. Eum commune incorrupte elaboråret nø, usu decore accusætæ temporibus cu. Cu pri alienum appetere posidonium. Ad qui delectus plåcerat. Id sed enim tempor interesset, cum eu essent menåndri erroribus.

Pro in etiam iudicø malørum, has impedit erroribus ea. Ea vix stet adølescens theophrastus. Oratio theophræstus ne mei, natum fugit pri ut. Primis antiopam repudiåre no eam, tollit viderer reprimique usu et.

Vis amet platonem ex. Etiam movet voluptaria eos ei. Affert feugait at quo. Ex sumø sølet accusamus sit. Stet reprehendunt ius eu, ne cum veritus torquatos voluptætum.

Ad integre ørnåtus ponderum nam, tåle menandri cu eos. Vis errem populo saperet eu. Option habemus antiøpam pri in. Et quo saepe minimum luptatum. Sed altera percipitur definitionem eæ. Sententiae appellantur te cum, dicunt intellegåm reprehendunt eum ut.",Heather Meta Taggesen,9d9e1cf8-b36f-43ce-9751-2c30069a28d4,cccdbe2a-fd36-4e58-b687-e81b440375b7
2019-07-19 00:00:00+00,Habibis ørkenbar,"Ei viderer molestiae vel, vix ad omnis eloquentiam, his ex tamquam menandri accusamus. Sit no causae feugait. Usu et errem persecuti, graeco deserunt conclusionemque et eos. Doming ocurreret mei ut, vis probo blandit honestatis et.","Lorem ipsum dolor sit amet, pro porro accommodare at, ei mel malis regione suscipit. Pericula urbanitas in nec. Utamur menandri volutpat nam in, possim legendos posidonium quo eu, cu odio propriae mea. Cu eos erant saperet conclusionemque, id quidam posidonium sit. Cum et natum placerat rationibus, qui id elit error phaedrum, cum dicta persius suscipiantur eu. Sit cu aperiri salutatus repudiandae, usu oporteat scriptorem et. Pri ei debitis omnesque scripserit, qui cu idque ullum ceteros, erat modus qui id.

At inani forensibus nec, cu iisque periculis sed. Ne cum ferri apeirian legendos, et nisl augue mei, no est dicta intellegam concludaturque. Summo conceptam ius in, ad his nisl posidonium, in suavitate repudiare consetetur eam. Te vis probatus interpretaris, te eam vidit denique.

Discere volutpat ut sit. Euismod liberavisse cu nam, inermis euripidis ad sea, ex mel nostro meliore inimicus. Alii persius menandri at eos, ex prima ancillae posidonium eum. Diceret scaevola usu ei. Fastidii pericula per ei.

Mel et rebum quaeque fastidii, ne mel erat detraxit accommodare. Ex nisl enim euismod cum, ius stet dicunt omnium id. Mel ex reformidans repudiandae, at mei harum viris. An tamquam vulputate moderatius vis, duo corrumpit democritum dissentiet ei. Sadipscing definitionem ex qui, et justo vocibus his. Cum te euripidis laboramus, meis dissentiet an eam, et rationibus sententiae duo.",Tim Vinther Sørensen,ef25ae85-c1ea-4e3d-8e9d-0404908e7ddf,4c35d44b-5d8b-40eb-bb79-08d86ffe4ba5